imdb_id,title,original_title,overview,poster_link
tt5458088,Kammatipaadam,‡¥ï‡¥Æ‡µç‡¥Æ‡¥ü‡µç‡¥ü‡¥ø‡¥™‡µç‡¥™‡¥æ‡¥ü‡¥Ç,"Krishnan, who has been living away from his family and friends in Mumbai, gets a call from his friend Ganga in Kerala, out of the blue. He senses danger, and leaves for Kammattipadam, where both of them grew up.",https://m.media-amazon.com/images/M/MV5BNWUwZjk2NTEtMWEwYy00NWRlLTllMmYtMzZiY2U5MWFhNzk2XkEyXkFqcGdeQXVyMjk0NTIxNjc@._V1_SX300.jpg
tt3257550,Hard Sell,Hard Sell,"When Hardy Buchanan, a senior at an elite private school, needs to make some quick cash, he enlists the help of Bo, a beautiful runaway. Together, they devise an unconventional plan of profiting off of the wayward teens at Hardy's school. When the students learn that Bo has more to offer than what meets the eye, the unlikely duo's new business takes a unique turn, tossing them headfirst into the lifestyles of the rich and dysfunctional.",https://m.media-amazon.com/images/M/MV5BNWRkNWJjMzctZWVkMi00OGE4LWI5OTItOTZhNjBjMGI5OTEzXkEyXkFqcGdeQXVyMjMyMTg1OTM@._V1_SX300.jpg
tt5528278,Happy Wedding,‡¥π‡¥æ‡¥™‡µç‡¥™‡¥ø ‡¥µ‡µÜ‡¥°‡µç‚Äå‡¥°‡¥ø‡¥ô‡µç,The story of an engineering graduate (Wilson) as he contemplates marriage on his mother's insistence.,https://images-na.ssl-images-amazon.com/images/M/MV5BZjc2NDZiZTAtZGU0NC00NGNkLWEwNTctNTUzMjRlMGJhNDdkXkEyXkFqcGdeQXVyMjkxNzQ1NDI@._V1_SX300.jpg
tt4936450,Graduation,Bacalaureat,"Romeo Aldea, a physician living in a small mountain town in Transylvania, has raised his daughter Eliza with the idea that once she turns 18, she will leave to study and live abroad. His plan is close to succeeding. Eliza has won a scholarship to study psychology in the UK. She just has to pass her final exams ‚ a formality for such a good student. On the day before her first written exam, Eliza is assaulted in an attack that could jeopardize her entire future. Now Romeo has to make a decision. There are ways of solving the situation, but none of them using the principles he, as a father, has taught his daughter.",https://m.media-amazon.com/images/M/MV5BOGRmMTZkMzEtNjc0Ny00NzRmLTk4YTEtYzBmNDNjODQ5MjZkXkEyXkFqcGdeQXVyNDkzNTM2ODg@._V1_SX300.jpg
tt2248739,Departure,Departure,"An English mother and her teenage son spend a week preparing the sale of their remote holiday house in the South of France. Fifteen-year-old Elliot struggles with his dawning sexuality and an increasing alienation from his mother, Beatrice. She in turn is confronted by the realisation that her marriage to his father, Philip, has grown loveless and the life she knows is coming to an end. When an enigmatic local teenager, Clvment, quietly enters their lives, both mother and son are compelled to confront their desires and, finally, each other.",https://m.media-amazon.com/images/M/MV5BMjdjMDcxNDgtMDE0ZC00MGY1LTllY2ItYzBiYzBmNDFkOTk0XkEyXkFqcGdeQXVyMjEzOTAxMDc@._V1_SX300.jpg
tt2420876,Chicken,Chicken,"RICHARD, 15 with learning difficulties, longs to put down roots but his restless and destructive brother, POLLY, needs to keep moving. When the land they live on is bought by a new landowner, and the electricity supply to their caravan is cut, their already precarious living conditions get even worse. Then a chance meeting with the new landowner's daughter, 17 year old ANNABEL (Yasmin Paige), leaves RICHARD besotted; whilst POLLY befriends the guys who run a seedy traveling fair. Richards optimistic view on life becomes increasingly difficult to maintain as Polly's abusive behavior worsens, family secrets are revealed, and he is torn between loyalty to his brother and his first true friend in ANNABEL. For better or worse, Richards life is about to change forever.",https://m.media-amazon.com/images/M/MV5BODY5ZTg2ZTEtZDE5ZS00YWY0LTgwYjYtNDQ2ZTljNjk5MWVlXkEyXkFqcGdeQXVyMTk1MTUyMDA@._V1_SX300.jpg
tt5773474,Brad Williams: Daddy Issues,Brad Williams: Daddy Issues,"In this hilarious new comedy special, stand-up Brad Williams tackles race and political correctness, as well as how his father raised him to deal with adversity.",https://images-na.ssl-images-amazon.com/images/M/MV5BOWZkYmUzZmItMjdjYy00MWUwLWE2ZGYtZjNlNmJkM2Y5ZTU4XkEyXkFqcGdeQXVyMjMxNTE1NjE@._V1_SX300.jpg
tt3349772,Back in the Day,Back in the Day,A young boxer is taken under the wing of a mob boss after his mother dies and his father is run out of town for being an abusive alcoholic.,https://m.media-amazon.com/images/M/MV5BMjAzNjI2Mzg4OV5BMl5BanBnXkFtZTgwMzkyNTg4OTE@._V1_SX300.jpg
tt3876860,Lily Lane,Liliom √∂sv√©ny,A mother and son as grapple with the questions of life and death on an inner journey filled with strange stories.,https://images-na.ssl-images-amazon.com/images/M/MV5BOTAyMDZmY2ItZGFkNC00MDY3LWJhMmEtMDQwNmJlYzFjZmNhXkEyXkFqcGdeQXVyMjU2MDI4NzM@._V1_SX300.jpg
tt5749224,Happy End,Happy End,"A splendid chain of unlikely encounters. Hunters, a tractor driver, a disco boy, and a corpse.",https://m.media-amazon.com/images/M/MV5BYWQ4MWQ5ZGEtNmE3Yy00MTE4LWJmMzItYTZlYTQ0ZTE4Nzg2XkEyXkFqcGdeQXVyNDQ5MDYzMTk@._V1_SX300.jpg
tt4949290,Cartels,Cartels,An elite team of DEA agents are assigned to protect a dangerous drug lord and take refuge in a luxury hotel while they await extraction. They soon find themselves at the center of an ambush as the drug lord's former associates launch an explosive assault on the hotel.,https://m.media-amazon.com/images/M/MV5BYTU2NWVjNGItNTEwNS00OGUyLWJkMGMtYTVkYTVmNzg0Nzk2XkEyXkFqcGdeQXVyOTE2MTYxOQ@@._V1_SX300.jpg
tt6135036,Canola,Í≥ÑÏ∂òÌï†Îßù,A girl who went missing after an accident returns 10 years later and reunites with her grandmother.,https://images-na.ssl-images-amazon.com/images/M/MV5BMWU1ZTA0YzQtNDAwYi00NTJlLTk5MWYtNTg3NzhkM2Y1NDAwXkEyXkFqcGdeQXVyMzk2OTE0NDI@._V1_SX300.jpg
tt3385516,X-Men: Apocalypse,X-Men: Apocalypse,"After the re-emergence of the world's first mutant, world-destroyer Apocalypse, the X-Men must unite to defeat his extinction level plan.",https://m.media-amazon.com/images/M/MV5BMjU1ODM1MzYxN15BMl5BanBnXkFtZTgwOTA4NDE2ODE@._V1_SX300.jpg
tt5699202,Timecode,Timecode,"Luna and Diego are the parking lot security guards. Diego does the night shift, and Luna works by day.",https://m.media-amazon.com/images/M/MV5BODVkYmRjM2QtNmY1OS00ZDA1LThmZGEtY2U1MTI0N2VhZDE3XkEyXkFqcGdeQXVyNTI5NjIyMw@@._V1_SX300.jpg
tt5038372,Fanny's Journey,Le voyage de Fanny,"Fanny is a Jewish girl in a French orphanage in 1943. When she and her friends are no longer safe from the Nazis, they try to flee to Switzerland. After their guide disappears, Fanny has to take the lead and help the other kids make it over the mountains.",https://m.media-amazon.com/images/M/MV5BYzgzYzdlZTgtMGQxNS00MjllLTg1NjktMGQ4Y2MwNDU0NDZkXkEyXkFqcGdeQXVyNjM0OTcxMzE@._V1_SX300.jpg
tt2429278,The Ghost and the Whale,The Ghost and the Whale,"A man, Joseph, loses his wife at sea, then spirals deep into a world of confusion. The wife's brothers' need revenge! Joseph tries to tell anyone who will listen that a whale killed his beautiful Annabel Lee, but even he doesn't quite remember the truth. A journey into the depths of his mind, a conversation with a whale and blood thirsty brothers.",https://m.media-amazon.com/images/M/MV5BZTQ3MTc1OTAtNjMxNy00MTc1LTlkZDktNjcyYzJiZWQxOTM0XkEyXkFqcGdeQXVyMzM0OTM4MTQ@._V1_SX300.jpg
tt5653084,Superbia,Superbia,"The native people of the surrealistic land of Superbia, where men and women form separate societies, face the changes sparked by the first equal couple in their history.",https://images-na.ssl-images-amazon.com/images/M/MV5BMWY1NzYwNDgtMDJiYy00NDJmLWE5NDItOGY2MzYzYWRmMGE1XkEyXkFqcGdeQXVyMTMxNjQ4MzA@._V1_SX300.jpg
tt4621872,Like Crazy,La pazza gioia,"Beatrice is a blabbermouth and a so-called billionaire countess who likes to believe she‚ in intimacy with world leaders. Donatella is a young quiet tattooed woman, locked in her own mystery. They are both patients of a mental institution and subject to custodial measures.",https://m.media-amazon.com/images/M/MV5BOTM0NzhlNjMtZWEzMS00ZTY0LWIxNjMtMjZlYjdhODBkMTVkXkEyXkFqcGdeQXVyMTQwMjkwNjI@._V1_SX300.jpg
tt4763168,Kindergarten Cop 2,Kindergarten Cop 2,"Assigned to recover sensitive stolen data, a gruff FBI agent goes undercover as a kindergarten teacher, but the school's liberal, politically correct environment is more than he bargained for.",https://m.media-amazon.com/images/M/MV5BMTExNTVlMGYtNTU2ZC00ZGE3LWIyYTEtNDM3ZjAxZmRjYTRiXkEyXkFqcGdeQXVyMjU0NDExNDg@._V1_SX300.jpg
tt3899262,Cyborg X,Cyborg X,"After X-Corp, a radical weapons manufacturer, is taken over by a Cyber Virus, a group of survivors must fight to save humanity from the army of Machines the Virus now controls.",https://m.media-amazon.com/images/M/MV5BMTgyNDkzNjA0OV5BMl5BanBnXkFtZTgwMTM1Mzc0OTE@._V1_SX300.jpg
tt2381213,Sundown,Sundown,"High school seniors Logan and Blake prepare for an epic Spring Break as they travel to the beautiful and exotic Mexican beach resort of Puerto Vallarta hoping to hook up with their high school crushes. Surrounded by hot girls in teeny bikinis, the guys are truly in heaven. After meeting at a club, Logan falls for a mysterious local beauty named Gaby but then realizes the next morning, when his grandfather‚ Rolex watch is missing, that she was after more than just his heart.",https://m.media-amazon.com/images/M/MV5BMjAxMDgyMDEzOF5BMl5BanBnXkFtZTgwODU1NzA2ODE@._V1_SX300.jpg
tt4867094,Highly Strung,Highly Strung,"""Highly Strung"" A story of passion...of obsession...and possession A journey into a rarefied world of elusive tones evoked by horsehair on catgut, of investors lured to spend millions on unique instruments. The deadly sins of lust, jealousy and greed jostle with the purity of philanthropy and sonic perfection. A duel of tension and harmony in a Quartet of youthful virtuosi expanding their skills on a clutch of rare Guadagninis. An exploration of the mystery and the lost, delicate art of constructing these robust masterpieces Exquisite imagery will illuminate a complex history of enduring instruments and their temporary custodians. And then there's the music!",https://m.media-amazon.com/images/M/MV5BYWUzNmI5Y2MtM2JmZS00YmUzLTg5NjEtNjNmY2RiZGE5NDI3XkEyXkFqcGdeQXVyNjQwMjYzNjY@._V1_SX300.jpg
tt5265960,The Untamed,La regi√≥n salvaje,"Hypnotic, perturbing, and utterly enthralling, The Untamed combines a suspenseful family drama with truly bizarre elements of science fiction and horror. Desperate to flee but consumed by fear, Alejandra, a young mother and working housewife, is trapped in a violent and unsatisfying relationship with her husband, Angel. She leans on her brother Fabivn for support, but he has secrets of his own. All of their lives are turned upside down by the arrival of the mysterious Veronica. She convinces them that in the nearby woods, inside an isolated cabin, dwells something not of this world that could be the answer to all of their problems... something whose force they cannot resist and with whom they must make peace or suffer its wrath.",https://m.media-amazon.com/images/M/MV5BOTcyZjViMzMtNjcwNS00YjQyLWI3OGMtYWIzNGIwZDNkY2FiXkEyXkFqcGdeQXVyNTQwMDA5NTg@._V1_SX300.jpg
tt3799694,The Nice Guys,The Nice Guys,A private eye investigates the apparent suicide of a fading porn star in 1970s Los Angeles and uncovers a conspiracy.,https://m.media-amazon.com/images/M/MV5BMjcwNDA5MDYyNl5BMl5BanBnXkFtZTgwNjg0NDkzNzE@._V1_SX300.jpg
tt5605328,Tulips in Spring,Tulips in Spring,"At Payden Farms, Rose meets Tom Novak ‚ a handsome ‚flower broker‚ who acts as a liaison between the farm and local distributors ‚ and discovers that the farm is faltering financially and that her parents are considering selling it to a ruthless competitor. As a last-ditch effort, Tom arranges for Frank to enter his most special tulip in an upcoming flower contest with the hopes of achieving national recognition and generating business. But when Frank‚ flowers are mysteriously sabotaged, Rose struggles to find a way to get them to bloom in time for the competition. Along the way, she finds herself appreciating her humble beginnings, reconciling with Frank, and falling into a blossoming romance with Tom. With time running out, Rose must rediscover her green thumb to save her family‚ farm, and decide whether she‚all find true happiness ‚ and true love ‚ by staying in Los Angeles or returning to her folksy hometown.",https://m.media-amazon.com/images/M/MV5BMjBjMWM3NTktZGQ2Ny00ZGU5LTk1NTctODA5NTBhZjk1Njk2XkEyXkFqcGdeQXVyMDA0Mjk4MQ@@._V1_SX300.jpg
tt5106400,Shared Rooms,Shared Rooms,"A new romantic comedy feature film that brings together three interrelated tales of gay men seeking family, love and sex during the holiday season.",https://m.media-amazon.com/images/M/MV5BMGY5MGQzMmEtNjA3OC00YTEyLWFiNjMtMDc2OWM5MzNjN2Y1XkEyXkFqcGdeQXVyMjY0NzI0OA@@._V1_SX300.jpg
tt5456798,Mythica: The Iron Crown,Mythica: The Iron Crown,"When a team of unlikely heroes hijacks a steam-powered battle wagon, a daring young wizard (Marek) steals the final piece of the all-powerful Darkspore and embarks on a desperate quest to deliver the cursed artifact to the gods for safe keeping; but when they are caught in a death race between a ruthless team of elite mercenaries and a trinity of demons, Marek must learn to believe in herself before her friends are killed and the Darkspore is lost, to stop the evil necromancer (Szorlok) from uniting the Darkspore and flooding the living world with his legions of undead.",https://m.media-amazon.com/images/M/MV5BMmY0YjQwOTQtYzYwMy00NDFiLTkwY2UtNjA4YTkwMWI3YmYzXkEyXkFqcGdeQXVyNDUxNjc5NjY@._V1_SX300.jpg
tt4042994,If Cats Disappeared From the World,‰∏ñÁïå„Åã„ÇâÁå´„ÅåÊ∂à„Åà„Åü„Å™„Çâ,"A postman learns that he doesn't have much time left to live due to a terminal illness. A devil then appears in front of him and offers to extend his life if he picks something in the world that will disappear. The man thinks about his relationships with ex-friends, ex-lovers, relatives and colleagues who will be sincerely sad when he dies.",https://m.media-amazon.com/images/M/MV5BOGU4NzE1OTYtYTRhYy00YjEyLWI5MjctNzlhZTA2MzBiOWJkXkEyXkFqcGdeQXVyNDA1MDc4NDU@._V1_SX300.jpg
tt5651050,Bright Lights: Starring Carrie Fisher and Debbie Reynolds,Bright Lights: Starring Carrie Fisher and Debbie Reynolds,"An intimate portrait of Hollywood royalty featuring Debbie Reynolds, Todd Fisher, and Carrie Fisher.",https://m.media-amazon.com/images/M/MV5BMzllYTQwNDYtNGRhNy00MDIzLWI5ZTQtNTA0ZTY2ZGU1NjFhL2ltYWdlXkEyXkFqcGdeQXVyMTkzODUwNzk@._V1_SX300.jpg
tt5538800,Why Blame It on the Child?,¬øQu√© culpa tiene el ni√±o?,"Maru, after becoming pregnant from a drunken one night stand with a immature young unemployed bachelor, is determined to follow tradition and marry him anyways.",https://m.media-amazon.com/images/M/MV5BZjljMDAwNzctMWI1OC00ZDYwLTllZTItYTJmY2YwODNlYzFjXkEyXkFqcGdeQXVyNjM5NTk3MTA@._V1_SX300.jpg
tt5275886,Under the Gun,Under the Gun,"A look at the aftermath of the Sandy Hook massacre where 20 children were murdered at school by a crazed gunman, but lead to no changes in American gun laws.",https://m.media-amazon.com/images/M/MV5BMTc1NTI4OTM5OV5BMl5BanBnXkFtZTgwMjk5Mzg2ODE@._V1_SX300.jpg
tt1878841,The Darkness,The Darkness,A family returns from a Grand Canyon vacation with a supernatural presence in tow.,https://m.media-amazon.com/images/M/MV5BMjIxMTg2NjAyMV5BMl5BanBnXkFtZTgwNDE5ODIxODE@._V1_SX300.jpg
tt3065204,The Conjuring 2,The Conjuring 2,Lorraine and Ed Warren travel to north London to help a single mother raising four children alone in a house plagued by malicious spirits.,https://m.media-amazon.com/images/M/MV5BZjU5OWVlN2EtODNlYy00MjhhLWI0MDUtMTA3MmQ5MGMwYTZmXkEyXkFqcGdeQXVyNjE5MTM4MzY@._V1_SX300.jpg
tt3187378,The Asian Connection,The Asian Connection,"Two American expatriates, Jack and Sam, unwittingly steal a drug lord's money when they rob a series of banks in Southeast Asia and become the target of the gang's vengeance.",https://m.media-amazon.com/images/M/MV5BMWQxYWRjNzYtZGNmNS00MDY2LTk3ZDctNTY5MWY2MGE1NmQwXkEyXkFqcGdeQXVyNTk5NTM0MTI@._V1_SX300.jpg
tt2638662,Summer Camp,Summer Camp,"A group of people have just signed up to be camp Councillors at a foreign country.  They expect the camp to be the place for a memorable summer.  Instead, something strange is going on and some of the campers begin to act strange.  Things go terribly wrong real fast as a terrible game of tag has the campers running for their lives or going after the campers.",https://m.media-amazon.com/images/M/MV5BMjQwMDAzNTE4Nl5BMl5BanBnXkFtZTgwNTExNjY3NjE@._V1_SX300.jpg
tt4726636,Slack Bay,Ma loute,"Summer 1910. Several tourists have vanished while relaxing on the beautiful beaches of the Channel Coast. Infamous inspectors Machin and Malfoy soon gather that the epicenter of these mysterious disappearances must be Slack Bay, a unique site where the Slack river and the sea join only at high tide.",https://m.media-amazon.com/images/M/MV5BY2JkMDNmY2ItN2VlMS00ZTQ3LTg2ZTctOTJlNWE3NzBlMTMwXkEyXkFqcGdeQXVyODM3MjA1NA@@._V1_SX300.jpg
tt5200506,Michael Ian Black: Noted Expert,Michael Ian Black: Noted Expert,"Veteran of sketch, television, and film, comedian Michael Ian Black has mastered a delivery that's equal parts dapper and deadpan, whether he's discussing the pro-choice debate or the Tilt-A-Whirl.  Taped at John Jay College in New York City, Black's first comedy special for EPIX includes his wry take on the human experience, from parenting and gender roles, to guilty pleasures of all shapes and sizes.",https://m.media-amazon.com/images/M/MV5BNzFhMTUxZTItMjg3My00NjU5LThjOTMtZWRiYzcwNGIwYzUxXkEyXkFqcGdeQXVyMDEzNDYxMA@@._V1_SX300.jpg
tt3513054,Last Days in the Desert,Last Days in the Desert,"On his way out of the wilderness, Jesus struggles with the Devil over the fate of a family in crisis, setting himself up for a dramatic test.",https://m.media-amazon.com/images/M/MV5BMTQ2NDk0MTc1MV5BMl5BanBnXkFtZTgwMTU3MjM0ODE@._V1_SX300.jpg
tt2667380,Kill Command,Kill Command,"Set in a near future, technology-reliant society that pits man against killing machines. Against this backdrop an elite army unit is helicoptered to a remote, off-the-grid island training facility. What starts out as a simple training exercise for Captain Bukes and his tight-knit unit, descends into a terrifying battle to the death, as the marines discover the island is overrun by an enemy that transcends the human concept of evil.",https://m.media-amazon.com/images/M/MV5BMmUwNjkzODQtN2Y5Ni00YTg2LWI0NjQtMTU4ODc0OWM3YjA0XkEyXkFqcGdeQXVyMTMxMTY0OTQ@._V1_SX300.jpg
tt1890363,Buddha in a Traffic Jam,Buddha in a Traffic Jam,"Vikram is a happy-go-lucky management student from a top Business School of India. He becomes an overnight sensation after a successful internet campaign against the radical fundamentalism of moral policing in India. This prompts his university teacher - Professor Ranjan Batki, to throw him a challenge for yet another internet campaign that would help raise money via a non-profit Pottery Club for poor people living in Maoists areas of India. Little does Vikram know that he is about to become a part of a plot that would risk his life and the nation. He gets entangled between two corrupt facets of India - Socialism and Capitalism, both of which are deeply rooted in India. It's a story inspired from true life incidents of Underbelly India.",https://m.media-amazon.com/images/M/MV5BMDYwODRmMWMtZjRjMi00NGUwLWFhNmItOWVhZTRjN2VhNTFhXkEyXkFqcGdeQXVyMjE2ODY4Mzc@._V1_SX300.jpg
tt4906984,Azhar,Azhar,"Indian biographical sports film directed by Tony D'Souza based on the life of the former Indian international cricketer, Mohammad Azharuddin. It will star emraan hashmi in the lead role alongside Prachi Desai , Nargis Fakhri and Huma Qureshi",https://m.media-amazon.com/images/M/MV5BZjdiNjI1NWItZmJiOC00MWVjLThhNmMtMzIyZGU5NjdjMmE0XkEyXkFqcGdeQXVyMjUxMTY3ODM@._V1_SX300.jpg
tt5215952,The Wailing,Í≥°ÏÑ±,A stranger arrives in a little village and soon after a mysterious sickness starts spreading. A policeman is drawn into the incident and is forced to solve the mystery in order to save his daughter.,https://m.media-amazon.com/images/M/MV5BODkwMTgxNjA2NF5BMl5BanBnXkFtZTgwMDc0OTcwOTE@._V1_SX300.jpg
tt2241351,Money Monster,Money Monster,Financial TV host Lee Gates and his producer Patty are put in an extreme situation when an irate investor takes over their studio.,https://m.media-amazon.com/images/M/MV5BMTgzMjU1NDUwMl5BMl5BanBnXkFtZTgwODg1NjY0ODE@._V1_SX300.jpg
tt5050788,Loev,Loev,"When hot shot, Wall Street dealmaker Jai thinks of putting some pleasure into his 48 hour business trip to Mumbai, Sahil, his young, music-producer friend, drops everything, including his reckless boyfriend Alex, to help him execute the perfect getaway. Hiking the hills and canyons of Maharashtra, amidst half-attempted conversations and sudden silences, business calls and old jokes, the friends discover there is more than just time-zones keeping them apart. Things take another turn when Alex shows up with a new male-companion at his side, throwing up old conflicts and bringing unanswered questions to the fore.",https://m.media-amazon.com/images/M/MV5BNjc2NzY0MDk1NF5BMl5BanBnXkFtZTgwNzY0NDAzMjI@._V1_SX300.jpg
tt1985949,The Angry Birds Movie,The Angry Birds Movie,"An island populated entirely by happy, flightless birds or almost entirely. In this paradise, Red, a bird with a temper problem, speedy Chuck, and the volatile Bomb have always been outsiders. But when the island is visited by mysterious green piggies, it‚ up to these unlikely outcasts to figure out what the pigs are up to.",https://m.media-amazon.com/images/M/MV5BMTY3MjU0NDA0OF5BMl5BanBnXkFtZTgwNTc0MTU3OTE@._V1_SX300.jpg
tt4513674,Caf√© Society,Caf√© Society,"The story of a young man who arrives in Hollywood during the 1930s hoping to work in the film industry, falls in love, and finds himself swept up in the vibrant cafv society that defined the spirit of the age.",https://m.media-amazon.com/images/M/MV5BYzkzMzdjMTQtZGI3OS00NTI4LWI3YzktYmZlNmUxMjgwN2U5XkEyXkFqcGdeQXVyNDQzMDg4Nzk@._V1_SX300.jpg
tt5724616,Brexit: The Movie,Brexit: The Movie,"A feature-length documentary to show why Britain should vote to LEAVE the EU - and would thrive outside of it.  Brexit: The Movie spells out the danger of staying part of the EU. Is it safe to give a remote government beyond our control the power to make laws? Is it safe to tie ourselves to countries which are close to financial ruin, drifting towards scary political extremism, and suffering long-term, self-inflicted economic decline?",https://ia.media-imdb.com/images/M/MV5BODE1MTY2N2UtZjk5Yi00MzBhLTliNDktZjIzYTdlNzI0OGI0XkEyXkFqcGdeQXVyNjcyMDg2NTM@._V1_SX300.jpg
tt5069074,A Billion Lives,A Billion Lives,"In 20 years‚a time, there will be nearly 1.6 billion smoker around the world. Approximately 70% of smokers want to quit. The United Nations‚a World Health Organisation expects a billion people will die prematurely from smoking this century. The products their doctors recommend are rarely effective and many are trapped. A new vapour technology was invented to give smokers a successful way to quit. But it was quickly demonised, and even banned in many countries. A perfect storm is brewing between smokers trying to quit, government regulators, and health charities funded by the powerful pharmaceutical industry. Director Aaron Biebert travelled across four continents interviewing doctors, scientists, and others working to save a billion lives. What he found was profound government failure, widespread corruption in the public health community and powerful subversion by big business.",https://m.media-amazon.com/images/M/MV5BODk3Y2I2MmEtODc5My00ZjhlLTlkNzItYTk1MzhiNWI1YmY5XkEyXkFqcGdeQXVyNjc2ODkxNDc@._V1_SX300.jpg
tt5660830,The Polar Boy,Polaarpoiss,"Mattias has a dream to become a photography student of the Berlin Arts Academy. On the journey of following his calling, his dream is constantly put to a test after Mattias falls in love with a beautiful free spirit Hanna. Trying to win her heart, Mattias feels the need to prove Hanna, that he can be just as adventurous and unpredictable as she is. Breaking the law together with Hanna, Mattias risks everything dear to him, not knowing yet, that Hanna's bold acts are only the symptoms of bipolar disorder. In the moment of jelousy Mattias accidentally commits a crime that could put him behind bars for years. The only escape he sees is to get himself declared irresponsible. In order to achieve that Mattias decides to start faking the illness her gilfriend really has - bipolarity.",https://ia.media-imdb.com/images/M/MV5BODZkMGVhMGQtMTJhNy00MDA1LWExOTEtNWFjMzkzMTU1OWFlXkEyXkFqcGdeQXVyMjg5MjUyNQ@@._V1_SX300.jpg
tt3655972,The Olive Tree,El olivo,"Alma‚ family has been producing quality olive oil in the Baix Maestrat area of Spain‚ Castellvn for generations. Yet changing pressures in the industry have made their traditional practices economically untenable, and the family is now in the mass-production poultry business.  Alma‚ grandfather has not spoken in years. Sadness envelopes him, and he no longer wants to eat. His sons‚Alma‚ father and uncle‚are impatient with him, but Alma understands her grandfather. She realizes he has been grieving for a thousand-year-old olive tree that the family has uprooted and sold to pay some debts. (A sadly common reality in Castellvn at present.) Unable to bear the idea that her grandfather could die without seeing this terrible wrong corrected, Alma undertakes a quixotic mission to locate the tree and return it to the family orchard, so that her grandfather may have peace in his final days.",https://m.media-amazon.com/images/M/MV5BODBjYmIwNmItMzNhZi00NGQ5LThlN2MtMmIzYWJlYmMxYTY0L2ltYWdlXkEyXkFqcGdeQXVyMTg2NTc4MzA@._V1_SX300.jpg
