imdb_id,title,original_title,overview,poster_link
tt4906686,All Hallow's Eve,All Hallow's Eve,"Eve Hallows' 18th birthday comes with an unexpected family legacy of magic. When Eve attempts a spell to speak with her deceased mother, she accidentally summons a vengeful witch who threatens to wreak havoc. As a Halloween party goes wrong and a theater becomes the stage for disaster, it is up to Eve to believe in herself and take control of her destiny.",https://m.media-amazon.com/images/M/MV5BNjkzNzdkYWQtYjAzMS00MmVkLWFhYmUtYzI2MjA4M2Q5NDBlXkEyXkFqcGdeQXVyNjc4MzkxMjk@._V1_SX300.jpg
tt4706888,Laid in America,Laid in America,Two foreign exchange high-school students are kidnapped during their quest to get laid on their last night in America.,https://m.media-amazon.com/images/M/MV5BYjY1MzY1NDItNzAzMS00MWQ1LTgwYTEtOGY3YzA4NGFhYTk4XkEyXkFqcGdeQXVyNjMxOTMwNzA@._V1_SX300.jpg
tt6047684,"Signed, Sealed, Delivered: Lost Without You","Signed, Sealed, Delivered: Lost Without You","Oliver's (Eric Mabius) Divine Delivery Theory is put to the test when he and the POstables (Kristin Booth, Geoff Gustafson and Crystal Lowe) seem to be unable to deliver a damaged letter from a military veteran that's a matter of life and death",https://m.media-amazon.com/images/M/MV5BZjNlNmYxMDUtYzBmYS00NmIwLWE2MDAtOTE5ZDI4YjJjYmRhXkEyXkFqcGdeQXVyMTExNjAwNw@@._V1_SX300.jpg
tt5567492,Gatekeeper,Gatekeeper,"A retired police detective dedicates his life to preventing deaths at Japan‚ suicide cliffs, providing emergency assistance and counseling even as tourists flock to the site, attracted by its notoriety as a popular suicide destination.",https://m.media-amazon.com/images/M/MV5BZjA5Mjc1ZjAtY2U0Ny00OTY4LWFjMDMtOTg5NDU1ZWQwM2E2XkEyXkFqcGdeQXVyOTg5Nzg2Mg@@._V1_SX300.jpg
tt4468634,Certain Women,Certain Women,"The lives of three women intersect in small-town America, where each is imperfectly blazing a trail.",https://m.media-amazon.com/images/M/MV5BMjIyOTY0MjcxMV5BMl5BanBnXkFtZTgwODgxMTE5OTE@._V1_SX300.jpg
tt1183374,Pet,Pet,"A man imprisons the woman he's still obsessed with after years apart, then finds the tables turned on him.",https://m.media-amazon.com/images/M/MV5BMTg5NTE3MzUyOV5BMl5BanBnXkFtZTgwOTQ2ODI0MDI@._V1_SX300.jpg
tt5147214,Headshot,Headshot,"A young man washes ashore, his memory gone - but his past comes back to haunt him after he is nursed back to health and his killing ability is needed when he takes on a powerful drug lord.",https://m.media-amazon.com/images/M/MV5BMjI2MzU2ODQ4M15BMl5BanBnXkFtZTgwOTgxMTU5OTE@._V1_SX300.jpg
tt6071534,Gringo: The Dangerous Life of John McAfee,Gringo: The Dangerous Life of John McAfee,"The strange story of John McAfee, who went from millionaire software mogul to yogi, Kurtz-like jungle recluse to potential murderer, and most recently a prospective presidential candidate for the American Libertarian Party.",https://m.media-amazon.com/images/M/MV5BN2RkMmNkYjktMjk2My00YjQxLTk5YmMtZTc1Y2YyMWY4ZmVjXkEyXkFqcGdeQXVyNTY1OTQ4MzQ@._V1_SX300.jpg
tt5929796,The Rolling Stones - Havana Moon,The Rolling Stones - Havana Moon,"The historic concert appearance of the British band in Cuba on March 25th, 2016. The ""Concert for Amity"" was and played at the Ciudad Deportiva Stadium - the bands first show in Cuba and the finale of their South America Tour.",https://m.media-amazon.com/images/M/MV5BOTVmNTFkNzktMDc5MC00MWU4LWE5OTItMDA0YzViODViNGUzXkEyXkFqcGdeQXVyNDgzNDU1MzA@._V1_SX300.jpg
tt5278868,The Lovers and the Despot,The Lovers and the Despot,"After the collapse of their glamorous romance, a famous director and actress are kidnapped by movie-obsessed dictator Kim Jong-il. Forced to make films in the world's weirdest state, they get a second chance at love, but only one chance at escape.",https://m.media-amazon.com/images/M/MV5BMTUzNTQ3MjA4N15BMl5BanBnXkFtZTgwNzQxODAyOTE@._V1_SX300.jpg
tt4547056,The Girl with All the Gifts,The Girl with All the Gifts,A scientist and a teacher living in a dystopian future embark on a journey of survival with a special young girl.,https://m.media-amazon.com/images/M/MV5BMjQ0NzA4NDcxM15BMl5BanBnXkFtZTgwMTk1NjUzOTE@._V1_SX300.jpg
tt3517044,The Free World,The Free World,"Following his release from a brutal stretch in prison for crimes he didn't commit, Mo is struggling to adapt to life on the outside. When his world collides with Doris, a mysterious woman with a violent past, he decides to risk his newfound freedom to keep her in his life.",https://m.media-amazon.com/images/M/MV5BMTY4MzU2NDg5Nl5BMl5BanBnXkFtZTgwNzA3MjgxMDI@._V1_SX300.jpg
tt1713440,Smoke & Mirrors,El hombre de las mil caras,"A tale of cheats and impostors, taking its inspiration from true facts and from one of the most intriguing characters of recent decades: the spy Francisco Paesa.",https://m.media-amazon.com/images/M/MV5BODk1MmE4OTQtMTQ5OS00MGFhLWJmMGYtNzFiYjM0M2U5NjMwXkEyXkFqcGdeQXVyMTA0MjU0Ng@@._V1_SX300.jpg
tt4341582,Queen of Katwe,Queen of Katwe,A young girl overcomes her disadvantaged upbringing in the slums of Uganda to become a Chess master.,https://m.media-amazon.com/images/M/MV5BNzQ0MDg2NTY4N15BMl5BanBnXkFtZTgwOTk2NzU3OTE@._V1_SX300.jpg
tt5538568,My Entire High School Sinking Into the Sea,My Entire High School Sinking Into the Sea,"Best friends Dash and Assaf are sophomores at Tides High, where they author the entire school newspaper. When their editor starts offering Assaf solo assignments, Dash's jealousy prompts him to publish a fictitious story about Assaf having erectile dysfunction. Later, while rummaging through the school archives, Dash discovers records indicating that the building isn't up to code. He tries to warn his schoolmates, but after his slanderous attacks on Assaf, nobody believes him. Then it happens: an earthquake sends the school toppling into the Pacific...",https://m.media-amazon.com/images/M/MV5BMTc1ODk0NzEwNl5BMl5BanBnXkFtZTgwMjQ2MzQ1MTI@._V1_SX300.jpg
tt4636254,Little Wing,Tytt√∂ nimelt√§ Varpu,"Little Wing tells the story of 12-year-old Varpu, who's quickly growing to adulthood, and about her mother, who doesn't want to grow up. Varpu lives with her mother and has never met her father. One night Varpu has enough of her riding buddies and her mother. She steals a car and drives up north in search of her father, of whom she only knows the name. But her father is not exactly what she had expected. Meeting him trigger something in Varpu and Siru's life, making them realize their role in each other's lives, and in the world.",https://m.media-amazon.com/images/M/MV5BZjRlMzczZDEtMTM3ZS00Mzk3LThmYWEtYmViMmI0NzNhYmRjXkEyXkFqcGdeQXVyMTIxMzMzMzE@._V1_SX300.jpg
tt6081882,Iliza Shlesinger: Confirmed Kills,Iliza Shlesinger: Confirmed Kills,"The standup sensation tackle's TV's ""Shark Tank,"" what it means to be a woman and how to deal with the lawless party goblin that lives in us all.",https://m.media-amazon.com/images/M/MV5BZGEyYjkwMWItM2EyZS00N2Q1LWIzZmQtZDg5Y2ZmMzdlNTgyXkEyXkFqcGdeQXVyNjgzNzA2NjU@._V1_SX300.jpg
tt4437216,Goat,Goat,"Reeling from a terrifying assault, a nineteen year old enrolls into college with his brother and pledges the same fraternity. What happens there, in the name of 'brotherhood,' tests him and his loyalty in brutal ways.",https://m.media-amazon.com/images/M/MV5BMTUxNjg1ODY3Ml5BMl5BanBnXkFtZTgwODEyNjUzOTE@._V1_SX300.jpg
tt2268433,End of a Gun,End of a Gun,A mall security guard -- and former federal agent -- crosses paths with a drug kingpin's enforcer after he saves a woman from danger.,https://m.media-amazon.com/images/M/MV5BMTkwNzEzODIzNF5BMl5BanBnXkFtZTgwNzk2NzU3OTE@._V1_SX300.jpg
tt5521550,Dirty 30,Dirty 30,"Lifelong friends Kate (Mamrie Hart), Evie (Grace Helbig) and Charlie (Hannah Hart) are in a rut. Kate spends her days at a middling job and her nights alone or on failed dates. Evie is married with the in-laws from hell, wandering from one charitable cause to the next. Charlie has the girl of her dreams but just can‚at seem to pull her business (or her act) together. On the eve of Kate‚ 30th birthday, she agrees to let Evie and Charlie throw her a party. But what‚ supposed to be a simple celebration becomes a wild who‚ who of past and present, and things quickly spiral out of control.",https://m.media-amazon.com/images/M/MV5BNzA0OTk5MDY5OF5BMl5BanBnXkFtZTgwMjMwOTgyOTE@._V1_SX300.jpg
tt5278460,Audrie & Daisy,Audrie & Daisy,"A documentary film about three cases of rape, that includes the stories of two American high school students, Audrie Pott and Daisy Coleman. At the time of the sexual assaults, Pott was 15 and Coleman was 14 years old. After the assaults, the victims and their families were subjected to abuse and cyberbullying.",https://m.media-amazon.com/images/M/MV5BNzM3NDkyMjU1NV5BMl5BanBnXkFtZTgwNjQwNDc4OTE@._V1_SX300.jpg
tt4065414,A Good American,A Good American,"A Good American tells the story of the best code-breaker the USA ever had and how he and a small team within NSA created a surveillance tool that could pick up any electronic signal on earth, filter it for targets and render results in real-time while keeping the privacy as demanded by the US constitution.",https://m.media-amazon.com/images/M/MV5BZTM3ZTViM2YtNjIzYy00NDNkLTlkZGQtOWRlN2QxOWYxMTE3XkEyXkFqcGdeQXVyNjU5Nzg4NDA@._V1_SX300.jpg
tt1655461,Wild Oats,Wild Oats,"Everything changes for Eva when she receives an insurance settlement check accidentally made out for $5,000,000 instead of the expected $50.000. She and her best friend take the money and head out for the adventure of a lifetime.",https://m.media-amazon.com/images/M/MV5BMzE0OTcyNDExNF5BMl5BanBnXkFtZTgwMjk5OTU4OTE@._V1_SX300.jpg
tt2032572,USS Indianapolis: Men of Courage,USS Indianapolis: Men of Courage,"The harrowing true story of the crew of the USS Indianapolis, who were stranded in the Philippine Sea for five days after delivering the atomic weapons that would eventually end WWII. As they awaited rescue, they endured extreme thirst, hunger, and relentless shark attacks.",https://m.media-amazon.com/images/M/MV5BYmYxYjAxNDItZWY2NC00MTE1LWIxNGMtZjkzOTM3MzIwM2RjXkEyXkFqcGdeQXVyNDI0MTYyNzU@._V1_SX300.jpg
tt6176078,The Master: A Lego Ninjago Short,The Master: A Lego Ninjago Short,Master Wu gets into a conflict with Chicken.,https://m.media-amazon.com/images/M/MV5BNjg4MGIyODItNmYzOS00MDFhLTgxMTMtYzYzZTcxNTcyOGNiXkEyXkFqcGdeQXVyMzY3MDEzMTA@._V1_SX300.jpg
tt5207320,"Sweet, Sweet Lonely Girl","Sweet, Sweet Lonely Girl","Soon after moving in with her aging aunt Dora, Adele meets Beth, seductive and mysterious, who tests the limits of Adele's moral ground and sends her spiraling down a psychologically unstable and phantasmagoric path.",https://m.media-amazon.com/images/M/MV5BYmNmN2E2ZGMtZjk0ZS00NTEyLThmYzgtZjk5YTcxYzAwNmU5XkEyXkFqcGdeQXVyMjE5MTg3NA@@._V1_SX300.jpg
tt4624424,Storks,Storks,"Storks deliver babies‚aor at least they used to. Now they deliver packages for a global internet retail giant. Junior, the company‚ top delivery stork, is about to be promoted when he accidentally activates the Baby Making Machine, producing an adorable and wholly unauthorized baby girl...",https://m.media-amazon.com/images/M/MV5BMTYxNjI3MzcwMF5BMl5BanBnXkFtZTgwOTIyNDY5OTE@._V1_SX300.jpg
tt4969044,Riphagen,Riphagen,"The true story about the biggest warcriminal from Holland during world war II, Andries ""Al Capone"" Riphagen.",https://m.media-amazon.com/images/M/MV5BNDUxMGE1OGItZTk2OS00NGE4LTllZjItNDk1NGUwYzgwNDU0XkEyXkFqcGdeQXVyMjA5MDA0Mw@@._V1_SX300.jpg
tt5789664,Petersburg: Only for Love,–ü–µ—Ç–µ—Ä–±—É—Ä–≥. –¢–æ–ª—å–∫–æ –ø–æ –ª—é–±–≤–∏,"Petersburg. A Selfie comprises seven novellas about the beautiful city of St. Petersburg, Russia, shot by female directors. The film tells a story of a real, living and breathing city, rather than a mythical phantasm. Each novella tells its own story about love and loneliness, luck and hope.",https://images-na.ssl-images-amazon.com/images/M/MV5BMGNmZGQ0OTYtZWZjZi00ODY5LWIzZTEtNDQzYTVlYzJiYTE3XkEyXkFqcGdeQXVyNTE5MTMxNDc@._V1_SX300.jpg
tt6162808,Miss Saigon: 25th Anniversary,Miss Saigon: 25th Anniversary,"The 25th Anniversary performance ‚ filmed at London's Prince Edward Theatre in 2014 ‚ of the epic musical tale of a young Vietnamese bar girl, Kim, who falls in love with Chris, an American GI.  But their lives are torn apart by the fall of Saigon.",https://m.media-amazon.com/images/M/MV5BNjU4NTRlMTktOWRhZS00ZWE0LWJkNDMtNGQyNzAzZTRjYTE1XkEyXkFqcGdeQXVyMTMxODk2OTU@._V1_SX300.jpg
tt6043942,Samurai Rauni,Samurai Rauni Reposaarelainen,"Villagers are afraid of Samurai Rauni Reposaarelainen, who keeps them on their toes every day. When someone places a bounty on Rauni's head, he goes after this mysterious person.",https://images-na.ssl-images-amazon.com/images/M/MV5BNGI5ZGY2MzAtYjkyOC00YzNmLWFmYmMtNzZkOWM2ZTJlNmJjXkEyXkFqcGdeQXVyMjM5NjY2OTc@._V1_SX300.jpg
tt5078354,Cezanne and I,C√©zanne et moi,"They loved each other with the ardor of thirteen-year-old boys. Rebellion and curiosity, hopes and doubts, girls and dreams of glory ‚ they shared it all. Paul was rich, Emile poor. They went skinny-dipping, drank absinthe, starved, only to overeat. Sketched models by day, caressed them by night... Now, Paul is a painter and Emile a writer. Glory has passed Paul by. But Emile has it all: fame, money, the perfect wife, whom Paul once loved. They judge each other, admire each other, confront each other. They lose touch, meet up again, like a couple who cannot stop loving each other.",https://m.media-amazon.com/images/M/MV5BYzFmMzM4MWItOTBjYi00ZGUyLTg1N2MtMjUwYTU4NTBmMTkzXkEyXkFqcGdeQXVyMjQ3NzUxOTM@._V1_SX300.jpg
tt4549224,The Standoff,The Standoff,"At Big Jim‚ Auto Depot there‚ only one rule. The last man ‚ or woman ‚ standing wins. Eight teens enter, one teen leaves. Actually, all eight teens leave, but only one leaves with the ride of their dreams. To reach that dream, they‚are going through a nightmare. Keep your hand on the car. That sounds simple enough, but two days of sleep deprivation and fierce competition can make things awfully hard.",https://m.media-amazon.com/images/M/MV5BZDg3N2M1M2MtZTkyMS00OWEzLWE5NWYtMzc3MmY1ZmRkNWE3XkEyXkFqcGdeQXVyMzIyNDQ2MA@@._V1_SX300.jpg
tt3922798,The Siege of Jadotville,The Siege of Jadotville,Irish Commandant Pat Quinlan leads a stand off with troops against French and Belgian Mercenaries in the Congo during in the early 1960s.,https://m.media-amazon.com/images/M/MV5BZTAxZWViYTUtMDljNi00MmQ5LTk2MzEtYmIwZDNkOTFhZjk0XkEyXkFqcGdeQXVyNjkxOTcwNjc@._V1_SX300.jpg
tt6094760,Playground,Plac Zabaw,Final day of school in a small Polish town. It's the very last chance for 12-year-old Gabrysia to tell her classmate that she has fallen in love with him. She sets up a secret meeting and blackmails the boy to show up. But what was supposed to be an intimate talk spins out of control and leads to an unexpected ending.,https://m.media-amazon.com/images/M/MV5BNDA0ZWY1N2QtMTI1Ni00NGU3LTk5MGYtZGMyMjNmNGNkODZjXkEyXkFqcGdeQXVyNjg3MTIwODI@._V1_SX300.jpg
tt4550420,My Blind Brother,My Blind Brother,Love for the same woman causes conflict between an over-achieving blind athlete and the brother who made him that way.,https://m.media-amazon.com/images/M/MV5BMTczNDE2NTk5N15BMl5BanBnXkFtZTgwMDMxOTM4OTE@._V1_SX300.jpg
tt6087230,The Case of: JonBen√©t Ramsey,The Case of: JonBen√©t Ramsey,"Clemente is joined by Scotland Yard behavioral analyst Laura Richards. Together, and with the aid of several others involved in the original case, they will try and solve the mystery of Ramsey‚ death ‚once and for all.‚",https://m.media-amazon.com/images/M/MV5BMDc4ZTM5ZGEtZTc3ZC00OWZhLTk0NzktZGFhODA3MjcwNTI1XkEyXkFqcGdeQXVyMzU2Mzg3MjE@._V1_SX300.jpg
tt4795692,Sister Cities,Sister Cities,"Based on the internationally-acclaimed play by Colette Freedman, the story of 4 estranged sisters who reunite for their mother‚ alleged suicide.",https://m.media-amazon.com/images/M/MV5BN2U5MzY4MWEtNmI1Zi00YzFjLTgwMTAtY2NjZDMwZmI4YjBjXkEyXkFqcGdeQXVyMjA3MjQ4MTM@._V1_SX300.jpg
tt5323662,A Silent Voice,ËÅ≤„ÅÆÂΩ¢,"Shouya Ishida starts bullying the new girl in class, Shouko Nishimiya, because she is deaf. But as the teasing continues, the rest of the class starts to turn on Shouya for his lack of compassion. When they leave elementary school, Shouko and Shouya do not speak to each other again... until an older, wiser Shouya, tormented by his past behaviour, decides he must see Shouko once more. He wants to atone for his sins, but is it already too late...?",https://m.media-amazon.com/images/M/MV5BZDc2NGZiZDMtYjg3Ni00ZDhkLThlYWEtMzQwMDBlZDQzOWQ2XkEyXkFqcGdeQXVyNjc3OTE4Nzk@._V1_SX300.jpg
tt4714568,The Young Offenders,The Young Offenders,Two teenage boys cycle 160 km on stolen bikes pursued by police to find a missing bale of cocaine worth 7 million euro. Set around the real event of Ireland's biggest cocaine seizure in 2007 of 440 million euro.,https://m.media-amazon.com/images/M/MV5BNTAwMmU3NzQtNzE3MC00YTAyLTljMWEtOGI2NGQ1MDIwMjgzXkEyXkFqcGdeQXVyMzY3MDMwNQ@@._V1_SX300.jpg
tt6073176,The White Helmets,The White Helmets,"As daily airstrikes pound civilian targets in Syria, a group of indomitable first responders risk their lives to rescue victims from the rubble.",https://m.media-amazon.com/images/M/MV5BMzE4ZTQ3M2YtYjY4ZS00OWNhLWFkYjgtNWIyNzkyOWQ5MGE1XkEyXkFqcGdeQXVyMjMwNjUwMTc@._V1_SX300.jpg
tt2262315,The Good Neighbor,The Good Neighbor,Two high school filmmakers decide to create the illusion of a haunting on an unsuspecting neighbor.,https://m.media-amazon.com/images/M/MV5BMjI0NTA5ODc4NV5BMl5BanBnXkFtZTgwNjUzOTc2OTE@._V1_SX300.jpg
tt2352196,Thank You for Your Service,Thank You for Your Service,An investigation into the failed mental health policies within the US military and the deadly consequences to the troops.,https://m.media-amazon.com/images/M/MV5BMTczOTE5OTkyM15BMl5BanBnXkFtZTgwODg4NTkyNzE@._V1_SX300.jpg
tt5937770,Tell Me How I Die,Tell Me How I Die,"When a group of college students take part in a clinical drug trial, an unexpected side effect of the experimental medicine gives them terrifying visions of their own deaths...which begin to come true. As they scramble to escape their fate, they discover that the killer is among them and shares their ability to see the future - only he seems to be one step ahead of their efforts to survive.",https://m.media-amazon.com/images/M/MV5BM2YzNzRmZmEtMjBhMy00NjgyLWFjMWYtNjczNTMwMTNmNTEwXkEyXkFqcGdeQXVyMzQzNzg1MTc@._V1_SX300.jpg
tt4938484,Silicon Cowboys,Silicon Cowboys,"Launched in 1982 by three friends in a Houston diner, Compaq Computer set out to build a portable PC to take on IBM, the world‚ most powerful tech company. Many had tried cloning the industry leader‚ code, only to be trounced by IBM and its high-priced lawyers. Explore the remarkable David vs. Goliath story, and eventual demise, of Compaq, an unlikely upstart who altered the future of computing and helped shape the world as we know it today.",https://m.media-amazon.com/images/M/MV5BNWRjNmRiOTktZTg3YS00ZmNiLTkxOTgtNWQ1MDFkYmVmYjM3XkEyXkFqcGdeQXVyMjEyMjc0NjA@._V1_SX300.jpg
tt5571734,Pink,Pink,"Deepak is a lawyer suffering from bipolar disorder who experiences frequent mood swings. One night, Rajveer and his friends get drunk and try to molest Miss Arora and her two roommates leading to an accident. The film revolves around how Deepak fights the girls' case against these influential boys.",https://m.media-amazon.com/images/M/MV5BNGI1MTI1YTQtY2QwYi00YzUzLTg3NWYtNzExZDlhOTZmZWU0XkEyXkFqcGdeQXVyMDkwNTkwNg@@._V1_SX300.jpg
tt4196848,Mr. Church,Mr. Church,"A unique friendship develops when a little girl and her dying mother inherit a cook - Mr. Church. What begins as an arrangement that should only last six months, instead spans fifteen years.",https://m.media-amazon.com/images/M/MV5BMzUyNDA5Njc4NV5BMl5BanBnXkFtZTgwMDI1Nzg4OTE@._V1_SX300.jpg
tt4196832,Is That a Gun in Your Pocket?,Is That a Gun in Your Pocket?,"Spurred by a gun incident at a school, the women of one Texas town lead a movement to get rid of guns by withholding sex from their husbands.",https://m.media-amazon.com/images/M/MV5BMjAzODMyMDExMl5BMl5BanBnXkFtZTgwODkzODM2OTE@._V1_SX300.jpg
tt5097070,Dancer,Dancer,Sergei Polunin is a breathtaking ballet talent who questions his existence and his commitment to dance just as he is about to become a legend.,https://m.media-amazon.com/images/M/MV5BMjEzMTczNDAxNV5BMl5BanBnXkFtZTgwODIzMTkwMDI@._V1_SX300.jpg
tt5753806,Cedric the Entertainer: Live from the Ville,Cedric the Entertainer: Live from the Ville,"Donning his signature suit and fedora, the dapper comic offers a unique spin on getting old, the presidential election and ""Honky Tonk Badonkadonk.""",https://images-na.ssl-images-amazon.com/images/M/MV5BMTQ5NzgxNDcxOV5BMl5BanBnXkFtZTgwMTg1NjEwMDI@._V1_SX300.jpg
tt3230660,Cardboard Boxer,Cardboard Boxer,A homeless man is recruited by a bunch of rich kids to fight other impoverished people.,https://m.media-amazon.com/images/M/MV5BOTE5MDcxMzA0Ml5BMl5BanBnXkFtZTgwOTc4MDA5OTE@._V1_SX300.jpg
tt5979312,7:19,7:19,"At 7:19 a.m., on September 19th of 1985, the most destructive earthquake hit Mexico's City. Inside what's left of a building, a group of survivors fight for their lives waiting for rescue.",https://m.media-amazon.com/images/M/MV5BY2U5ZmY3NTUtNzIyNi00ZDExLWE2M2ItZDY0YTVmMDY3ZDg3XkEyXkFqcGdeQXVyMjYwNjY0Nw@@._V1_SX300.jpg
tt4083052,The Vessel,The Vessel,"Ten years after a tsunami destroyed a small-town elementary school with all the children inside, a young man builds a mysterious structure out of the school's remains, setting the town aflame with passions long forgotten.",https://m.media-amazon.com/images/M/MV5BNDEyMGViYjgtNjVkNi00NDhlLTg4OTEtOWI4NzdlNjZiNDNkXkEyXkFqcGdeQXVyMTY3NzkwODA@._V1_SX300.jpg
tt6070530,The Groom,–ñ–µ–Ω–∏—Ö,"On 9 May a German comes to Russia to marry the Russian beauty Alena, whom he had met in Berlin. The happy couple goes to the village to meet the bride‚ relatives. However, Alena‚ former husband Tolya is also on the way there: he has unexpectedly decided to get his wife back. Everything turns out as a romantic rivalry, which involves ‚ apart from Tolya and Helmut ‚ their friends, relatives, and the other inhabitants of the village: the businessman Yerofeev who has bought a house in the neighbourhood; a lost tank-man; and even a kite ‚ they all meddle in the events.",https://images-na.ssl-images-amazon.com/images/M/MV5BYjg5ZjdlNTUtMjcwMy00ODc1LTlkMjktMjcxNmI4NWNmODA0XkEyXkFqcGdeQXVyMTA5Mzk5Mw@@._V1_SX300.jpg
tt2531318,The Beatles: Eight Days a Week - The Touring Years,The Beatles: Eight Days a Week - The Touring Years,"The band stormed Europe in 1963, and, in 1964, they conquered America. Their groundbreaking world tours changed global youth culture forever and, arguably, invented mass entertainment as we know it today. All the while, the group were composing and recording a series of extraordinarily successful singles and albums. However the relentless pressure of such unprecedented fame, that in 1966 became uncontrollable turmoil, led to the decision to stop touring. In the ensuing years The Beatles were then free to focus on a series of albums that changed the face of recorded music.",https://m.media-amazon.com/images/M/MV5BMTc0NDgwMTk2OV5BMl5BanBnXkFtZTgwNjEzODIyOTE@._V1_SX300.jpg
tt3774114,Snowden,Snowden,CIA employee Edward Snowden leaks thousands of classified documents to the press.,https://m.media-amazon.com/images/M/MV5BMTg2MzYzNzgzOF5BMl5BanBnXkFtZTgwOTg4NzQ4OTE@._V1_SX300.jpg
tt3527166,Set the Thames on Fire,Set the Thames on Fire,Two young men plot to escape a dystopian future London ruled by corporate tyrant The Impresario,https://m.media-amazon.com/images/M/MV5BYWNkY2YwNzAtNTAyZC00Y2I5LTgzZGYtNWYzNGVkYzIxNDY3XkEyXkFqcGdeQXVyMzEwOTk1NDc@._V1_SX300.jpg
tt4019666,Love Stories,Desculpe o Transtorno,"Eduardo discovers he has a split personality: a buttoned-up Svo Paulo executive and beach-loving weekend playboy in Rio de Janeiro called Duca. Unconsciously, he becomes entangled with a woman although he's already engaged to another.",https://images-na.ssl-images-amazon.com/images/M/MV5BZjAyZGZkMTYtMjkwNi00NGU5LWFkNTEtMTE0MDFmODAyZTRhXkEyXkFqcGdeQXVyMTkzODUwNzk@._V1_SX300.jpg
tt4854126,In the Blood,I blodet,"It‚ summer in Copenhagen, it‚ a time of endless days and careless nights. Simon is a 23-year-old medical student. He and his friends party and drink and chase girls and wake up the next day to do the whole thing all over again. But it‚ also a time of unrest and change among the boys. Dreams shatter, love hurts, and friendships dissolve.",https://ia.media-imdb.com/images/M/MV5BZGRlNDk4MzYtZThlMS00ZWQyLWFhMTktNzM2ZTk0NzVhNzkzXkEyXkFqcGdeQXVyMjQ3NzUxOTM@._V1_SX300.jpg
tt3173594,Hacker,Hacker,"Alex, an immigrant from Ukraine comes to Canada and becomes involved with an online criminal organization called Darkweb. What starts off as a way to help his parents financially, soon becomes a personal vendetta against the entire banking system, when his mother is fired from her job at the bank",https://m.media-amazon.com/images/M/MV5BYjk3ZWQ4ZmMtNzM1OS00NDQxLWJmZjctNzFlODAyODRkMjcyXkEyXkFqcGdeQXVyMjEwODIzODA@._V1_SX300.jpg
tt4911940,Goodbye Berlin,Tschick,Two outsiders travel around the countryside during school holidays.,https://m.media-amazon.com/images/M/MV5BNzliNjY4YWItYzBmOC00MTY2LTliMDEtMTNmYTg4MWE1Y2U3XkEyXkFqcGdeQXVyNDE5MTU2MDE@._V1_SX300.jpg
tt3846334,"Gilda, No Me Arrepiento de Este Amor","Gilda, No Me Arrepiento de Este Amor",The life and death of the tropical singer Gilda.,https://m.media-amazon.com/images/M/MV5BZWZmZDY1NDMtMTBkMy00MjY0LTlkN2ItZDYyMzhjMzlhMmQ0XkEyXkFqcGdeQXVyMzA5NzYzNw@@._V1_SX300.jpg
