imdb_id,title,original_title,overview,poster_link
tt5606538,Confidential Assignment,Í≥µÏ°∞,"When a crime organization from North Korea crosses borders and enters South Korean soil, a South Korean detective must cooperate with a North Korean detective to investigate their whereabouts.",https://m.media-amazon.com/images/M/MV5BYThmMmE3NzYtNGIyMi00MmRhLWFkMDItZGU3NTgwNmExZTdmXkEyXkFqcGdeQXVyNjQ3ODkxMjE@._V1_SX300.jpg
tt5091612,A Bag of Marbles,Un sac de billes,"In occupied France, Maurice and Joseph, two young Jewish brothers left to their own devices demonstrate an incredible amount of cleverness, courage, and ingenuity to escape the enemy invasion and to try to reunite their family once again.",https://m.media-amazon.com/images/M/MV5BMDk5MGM3OWQtNzQxOC00MWNmLTllMTctNGExMTI5M2M5YTg3L2ltYWdlL2ltYWdlXkEyXkFqcGdeQXVyMjQ3NzUxOTM@._V1_SX300.jpg
tt6438918,Neal Brennan: 3 Mics,Neal Brennan: 3 Mics,"Wicked one-liners and soul-baring confessions converge in this uniquely intimate stand-up special from ""Chappelle's Show"" co-creator Neal Brennan.",https://m.media-amazon.com/images/M/MV5BM2NhZDRiODEtZDRhMS00Yzk4LWEzNDUtZDQ2ZWUwMjQ2NTM1L2ltYWdlXkEyXkFqcGdeQXVyNDA2NzI3NjQ@._V1_SX300.jpg
tt5493706,Death Race 2050,Death Race 2050,"The year 2050 the planet has become overpopulated, to help control population the government develops a race. The Death Race. Annually competitors race across the country scoring points for killing people with their vehicles.",https://m.media-amazon.com/images/M/MV5BMTkzNjA4MjgyMl5BMl5BanBnXkFtZTgwMTE1ODIyMDI@._V1_SX300.jpg
tt5687968,Rufus 2,Rufus 2,Rufus is a dog but turns into a human with a pendant. He meets a girl named Kat who asks him to go out. Kat is a cat who can also turn into a human as well.,https://m.media-amazon.com/images/M/MV5BYmNiN2JjNzgtMzAzNy00ZDk3LTgxNWUtZDcyZTM2YTgwNzBkXkEyXkFqcGdeQXVyMTM0ODAyOTc@._V1_SX300.jpg
tt3039472,"Return to Return to Nuke 'Em High, aka Volume 2","Return to Return to Nuke 'Em High, aka Volume 2","Following the events of Volume 1,  the mutated glee club continue their violent rampage in Tromaville. Chrissy and Lauren, two innocent lesbian lovers, must fight not only the Cretins, mutants, and monsters but also the evil Tromorganic Foodstuffs Conglomerate. Can they, and Kevin the Wonder Duck, save Tromaville High School and the world?",https://m.media-amazon.com/images/M/MV5BNjJmNTdkZmUtMWQwZi00M2YyLWEwNWMtMWM0OWFkYzE5MDQ4XkEyXkFqcGdeQXVyMjA5MzI2Njg@._V1_SX300.jpg
tt1293847,xXx: Return of Xander Cage,xXx: Return of Xander Cage,"Extreme athlete turned government operative Xander Cage comes out of self-imposed exile, thought to be long dead, and is set on a collision course with deadly alpha warrior Xiang and his team in a race to recover a sinister and seemingly unstoppable weapon known as Pandora's Box. Recruiting an all-new group of thrill-seeking cohorts, Xander finds himself enmeshed in a deadly conspiracy that points to collusion at the highest levels of world governments.",https://m.media-amazon.com/images/M/MV5BMzcwMjkxMzQ3NV5BMl5BanBnXkFtZTgwMzgyNDA5MDI@._V1_SX300.jpg
tt3297382,The Crash,The Crash,"In the not so distant future, a team of white collar criminals are enlisted by the Federal government to thwart a cyber-attack that threatens to bankrupt the United States of America.",https://m.media-amazon.com/images/M/MV5BMzI3OTkwODQxMF5BMl5BanBnXkFtZTgwNzg1MTE4MDI@._V1_SX300.jpg
tt1330018,The Book of Love,The Book of Love,"After tragedy strikes Henry and Penny, he befriends a tenacious young girl and discovers she is constructing a raft to sail across the Atlantic to find her lost father. Together, along with some unlikely friends, they set forth to construct the vessel and subsequently rebuild their lives.",https://m.media-amazon.com/images/M/MV5BNzA2NzEwOTczMV5BMl5BanBnXkFtZTgwNDI3MzE2MDI@._V1_SX300.jpg
tt5577742,Clinical,Clinical,"A psychiatrist tries to put her life back together after a violent attack by seeking to repair the life of a new patient, but he has his own terrifying history.",https://m.media-amazon.com/images/M/MV5BMjMzNTkwNzMyMF5BMl5BanBnXkFtZTgwNTg2MzIxMTI@._V1_SX300.jpg
tt5432114,Claire in Motion,Claire in Motion,"Claire is sure of herself, her work and family, until ‚ like a bad dream ‚ her husband disappears, leaving a trail of puzzling secrets that shatter her certainty.",https://m.media-amazon.com/images/M/MV5BMjExMTY4MTg2OV5BMl5BanBnXkFtZTgwMjM0OTE4MDI@._V1_SX300.jpg
tt3349578,Bad Kids of Crestview Academy,Bad Kids of Crestview Academy,"It's four years later, and a new group of students has been placed in Saturday detention at the infamous and prestigious Crestview Academy. When Siouxsie, sophomore 'undercrust,' crashes the party to avenge her sister's death, a Saturday detention reserved for the privileged seniors of Crestview Academy turns into a date in hell. It's not long before a navove pussycat lover, gay drug dealer, smokin' hot preacher's daughter, squeaky-clean senator's son, and the uninvited younger outsider find themselves locked-up in school with no way out, wondering who (or what) has set them up. Hilarity and suspense ensue while each 'bad kid' pits one against the other, and one by one each falls victim to absurdly gruesome 'accidents' while trying to escape.",https://m.media-amazon.com/images/M/MV5BZThkNThmNDEtYTEzNS00YThiLWJlNTEtMDM5Y2YxN2Q1M2NmL2ltYWdlL2ltYWdlXkEyXkFqcGdeQXVyMjc2NjAzMjI@._V1_SX300.jpg
tt4030600,The Bye Bye Man,The Bye Bye Man,"When three college students move into an old house off campus, they unwittingly unleash a supernatural entity known as The Bye Bye Man, who comes to prey upon them once they discover his name. The friends must try to save each other, all the while keeping The Bye Bye Man's existence a secret to save others from the same deadly fate.",https://m.media-amazon.com/images/M/MV5BMTcxOTE5NzQwNF5BMl5BanBnXkFtZTgwOTMzMTc1ODE@._V1_SX300.jpg
tt5458566,Small Town Killers,Dr√¶berne fra Nibe,"The two tradesmen Ib and Edward are tired of their lifeless marriages and dream of living the good life from the stash of money they've earned moonlighting for years. After a huge fight with their wives the two men get drunk and hire a Russian contract killer to do a hit on their spouses. But they have badly underestimated their wives, and this becomes the start of an absurd journey where Ib and Edward to their own horror end at the top of a kill list.",https://m.media-amazon.com/images/M/MV5BMjMwODU0MTA4NF5BMl5BanBnXkFtZTgwMTI3Mzk2MDI@._V1_SX300.jpg
tt2072233,Sleepless,Sleepless,"Undercover Las Vegas police officer Vincent Downs is caught in a high stakes web of corrupt cops and the mob-controlled casino underground. When a heist goes wrong, a crew of homicidal gangsters kidnaps Downs‚a teenage son. In one sleepless night he will have to rescue his son, evade an internal affairs investigation and bring the kidnappers to justice.",https://m.media-amazon.com/images/M/MV5BNjEwMDAyOTM4OV5BMl5BanBnXkFtZTgwMzc4MjMyMDI@._V1_SX300.jpg
tt6086080,Mad Families,Mad Families,Three families compete for a camping spot during a busy Fourth of July holiday weekend.,https://m.media-amazon.com/images/M/MV5BZjM0NDg2YjMtOWJlMy00NzQxLTkwMGItNmE1NTIyZjIzMDgwXkEyXkFqcGdeQXVyNjc4NTUzNzg@._V1_SX300.jpg
tt1895315,Brimstone,Brimstone,"In the menacing inferno of the old American West, Liz is a genuine survivor who is hunted by a vengeful preacher for a crime she didn‚at commit.",https://m.media-amazon.com/images/M/MV5BNGU0Y2VkMDAtMTA0YS00YzU1LWEwNzMtZDM1MzFiNWZmMDRkXkEyXkFqcGdeQXVyMjU2OTAyMzQ@._V1_SX300.jpg
tt6201292,Bairavaa,‡Æ™‡Øà‡Æ∞‡Æµ‡Ææ,A loan recovery agent takes on a corrupt head of an educational institution to save his girlfriend.,https://m.media-amazon.com/images/M/MV5BMzU4NmYwMDAtODBlNC00MDQ5LTk4NDItMDJmNGJiYjYzNjkzXkEyXkFqcGdeQXVyOTA0NTIzNzU@._V1_SX300.jpg
tt3014078,Shangri-La Suite,Shangri-La Suite,Karen and Jack met in a mental hospital and fell in love. They set out to follow what Jack thinks is his destiny: killing Elvis Presley.,https://m.media-amazon.com/images/M/MV5BOGJjNzdmMWUtNzM1NC00MTAzLWE5NzQtZDEzZWFjNWY4NWMwXkEyXkFqcGdeQXVyNjM0NTg0Njg@._V1_SX300.jpg
tt4762758,The Summoning,The Summoning,"When a law student uncovers chilling secrets and places her life at risk, a bitter, rough-around-the-edges detective gets assigned to her case.",https://m.media-amazon.com/images/M/MV5BZWE0N2E0YTYtMThhYy00MjY5LWI1NzgtZGVlYjhjZTM5Zjg2XkEyXkFqcGdeQXVyMjA1MzIxMjA@._V1_SX300.jpg
tt6090102,Jim Gaffigan: Cinco,Jim Gaffigan: Cinco,America's king of clean comedy delivers wickedly funny jokes in his fifth hour-long special.,https://m.media-amazon.com/images/M/MV5BYzM5N2YyODQtZTkyMC00ZGVhLWJmZmYtZTI3ZGM2ODAzMzA1L2ltYWdlXkEyXkFqcGdeQXVyMzcwMjcwNQ@@._V1_SX300.jpg
tt2122355,Hickey,Hickey,"Brilliant but insecure, young Ryan has 24 hours to save the store he hates in order to win the heart of the girl he loves.",https://m.media-amazon.com/images/M/MV5BMjA3NjA5MTIxMV5BMl5BanBnXkFtZTgwMjMwMTYxMDI@._V1_SX300.jpg
tt5954304,The Dragon Spell,–ú–∏–∫–∏—Ç–∞ –ö–æ–∂—É–º'—è–∫–∞,"Little Nicky, the son of the Tanner, a famous strongman, has made up his mind, that he can conquer the dragon as his father did long ago. Against prohibition of his father, Nicky has managed to get into trouble and now it depends only on his courage, whether he defeats the resurgent dragon and returns home from the magic world.",https://m.media-amazon.com/images/M/MV5BNzk2Mzc4MjkzMF5BMl5BanBnXkFtZTgwOTA3NDQ3OTE@._V1_SX300.jpg
tt6375308,David Bowie: The Last Five Years,David Bowie: The Last Five Years,"There was nothing predictable about David Bowie - everything was designed to intrigue, to challenge, to defy all expectations. But perhaps no period in David Bowie‚ extraordinary career raised more fascination, more surprise, and more questions, than the last five years.",https://m.media-amazon.com/images/M/MV5BYTQ3MTRlMWItY2RkMS00ZDIyLWI2NmItNDg3N2QzZjhkMjczXkEyXkFqcGdeQXVyMTQ3Njg3MQ@@._V1_SX300.jpg
tt5084198,Kizumonogatari Part 3: Reiketsu,ÂÇ∑Áâ©Ë™û„Äà‚Ö¢ÂÜ∑Ë°ÄÁØá„Äâ,"With help from Meme Oshino, the apparition specialist, Koyomi defeats the three powerful vampire hunters: Dramaturgy, Episode and Guillotinecutter. Koyomi takes back all the limbs of Kiss-shot Acerola-orion Heart-under-blade in order to become a human again.",https://m.media-amazon.com/images/M/MV5BMzNhZDNiMWItYmQzZC00YjBkLTk1MDMtYTExYTU3ODg3NzA0XkEyXkFqcGdeQXVyNTAyODkwOQ@@._V1_SX300.jpg
tt5740806,Coin Heist,Coin Heist,"When a crisis threatens to destroy their high school, four teens hatch a daring plan to raise $10 million. Step one? Breaking into the U.S. Mint.",https://m.media-amazon.com/images/M/MV5BNDM4NzhhNTQtZmUyMy00OTFlLWFlMzgtYTQ5OTE3YjBmMTA5L2ltYWdlL2ltYWdlXkEyXkFqcGdeQXVyNjczOTE0MzM@._V1_SX300.jpg
tt5580536,Arsenal,Arsenal,"After the deadbeat brother of a businessman is assumed to be in on his own kidnapping, his sibling must take action to rescue him.",https://m.media-amazon.com/images/M/MV5BMTEyMzk3ODYzMzdeQTJeQWpwZ15BbWU4MDk0MDc3ODAy._V1_SX300.jpg
tt3121200,Breakdown Lane,Breakdown Lane,"When Kirby Lane's SUV breaks down in the middle of the desert, she must overcome the dehydration, coyotes, and lurking undead to find her way home.",https://m.media-amazon.com/images/M/MV5BNWY4MmQ1ODMtMWFhMC00ZDI3LWFiZTYtYTlhYWMwMjM4ZDQyXkEyXkFqcGdeQXVyNjg0ODE1ODE@._V1_SX300.jpg
tt5286268,Family Heist,Mes tr√©sors,A high-profile burglar reconciles with his two daughters (half-siblings) to help him retaliate against his ex-partner who betrayed him.,https://m.media-amazon.com/images/M/MV5BYWM4MTMzNTUtN2FhNi00ZjkzLWE3YWMtOThhZGJlMWQ5M2NhL2ltYWdlL2ltYWdlXkEyXkFqcGdeQXVyMjQ3NzUxOTM@._V1_SX300.jpg
tt5764024,Ok Jaanu,Ok Jaanu,OK Jaanu is an upcoming Indian romantic drama film directed by Shaad Ali and produced by Karan Johar under his banner Dharma Productions. It is an official remake of Mani Ratnam's Tamil film OK Kanmani.,https://m.media-amazon.com/images/M/MV5BMWQ2ZjE4ZTMtYjNlOS00MmJmLTkzOWMtOWMwOTg4N2M4YWI5L2ltYWdlL2ltYWdlXkEyXkFqcGdeQXVyNjY1MTg4Mzc@._V1_SX300.jpg
tt6386352,Jen Kirkman: Just Keep Livin',Jen Kirkman: Just Keep Livin',"Incisive comic Jen Kirkman gets real about women's bodies, the value of alone time and an Italian private tour guide who may have been a ghost.",https://m.media-amazon.com/images/M/MV5BMGYzZGU2YzMtY2QyNi00MmZhLWFlMWUtNDdlOGI0YTllN2FlL2ltYWdlL2ltYWdlXkEyXkFqcGdeQXVyNjYzMDA4MTI@._V1_SX300.jpg
tt2957760,Extortion,Extortion,A doctor desperately tries to save his wife and their 5 year old son after their vacation in the Bahamas takes an unexpected turn.,https://m.media-amazon.com/images/M/MV5BYTE4MzA4NWEtNTI2NC00MzFlLWIzMTMtMzQzMDVkYjhlZmU0XkEyXkFqcGdeQXVyOTE2MTYxOQ@@._V1_SX300.jpg
tt6389344,Three heroes and the King of the Sea,Tri bogatyrya i Morskoy tsar,No plot overview available,https://m.media-amazon.com/images/M/MV5BOGU0MTkxYzQtYzI5OS00MzRmLTlmMzMtODZkMDI0MDg2MWI5L2ltYWdlL2ltYWdlXkEyXkFqcGdeQXVyNTk1MjA5MjM@._V1_SX300.jpg
tt6174392,The Avenue,The Avenue,"Giancarlo ""Eddie"" Marturano, a down and out gambler trapped in the world he's created for himself. Like his adopted home of Atlantic City, Eddie is beaten, down on one knee, struggling mightily to rise to his feet again. His only salvation is his beloved Sandra and their hope of a better future. When he and his partner in crime, Christian Flynn, stumble onto the deal of their lives, will it finally be their avenue out of town?",https://m.media-amazon.com/images/M/MV5BOWZkNTlhNzAtNGI0Ny00MTc2LThjMjUtM2EzNGUzMDQ0OGI5L2ltYWdlL2ltYWdlXkEyXkFqcGdeQXVyNTAwNzU2MDg@._V1_SX300.jpg
tt5033790,Banking on Bitcoin,Banking on Bitcoin,"Not since the invention of the Internet has there been such a disruptive technology as Bitcoin. Bitcoin's early pioneers sought to blur the lines of sovereignty and the financial status quo. After years of underground development Bitcoin grabbed the attention of a curious public, and the ire of the regulators the technology had subverted. After landmark arrests of prominent cyber criminals Bitcoin faces its most severe adversary yet, the very banks it was built to destroy.",https://m.media-amazon.com/images/M/MV5BMjE4MzM3Mjk5N15BMl5BanBnXkFtZTgwNDI3MTg2MDI@._V1_SX300.jpg
tt5157456,Viking,–í–∏–∫–∏–Ω–≥,"The early Middle Ages. A time of heavy swords and dark blood law. The ruling clan is in discord. The guilt for the accidental death of the brother has fallen on the Grand Duke. According to the law, revenge must be taken by the younger brother, a bastard. For the refusal to kill, he has to pay with eve- rything he had, because ‚for peace you need more swords than for a war‚...",https://m.media-amazon.com/images/M/MV5BMzI0NDU3MDAtOTE5Ni00ODM3LWFlYTgtY2ExZGYyMmU3M2E1XkEyXkFqcGdeQXVyNzI1NzMxNzM@._V1_SX300.jpg
tt5594080,To Walk Invisible,To Walk Invisible,"To Walk Invisible takes a new look at the extraordinary Brontv´ family, telling the story of these remarkable women who, despite the obstacles they faced, came from obscurity to produce some of the greatest novels in the English language.",https://m.media-amazon.com/images/M/MV5BNjkwMzQ5YTMtNTlhZi00MzY0LWEwNmMtZjk2NmU4YmI1ZTNjL2ltYWdlL2ltYWdlXkEyXkFqcGdeQXVyMjExMjk0ODk@._V1_SX300.jpg
tt4685554,The Snow Queen 3: Fire and Ice,–°–Ω–µ–∂–Ω–∞—è –∫–æ—Ä–æ–ª–µ–≤–∞ 3. –û–≥–æ–Ω—å –∏ –ª–µ–¥,"After heroically defeating both the Snow Queen and the Snow King, Gerda still cannot find peace. Her dream is to find her parents who were once taken away from them by the North Wind and finally reunite the family. Thus, Gerda and her friends embark on an exiting journey to find her parents and encounter new challenges along the way: they discover an ancient magical artifact of the trolls, the Stone of Fire and Ice. From that moment on, things don't go according to the initial plan...Will Gerda be able to tame the mighty forces of the magical elements and get her family back? The answer will be reveled in 2016. This is a story which encompasses everything you love about Wizart: kindness, bravery, friendship, mystery, love of one's family, and a happy ending, of course!",https://m.media-amazon.com/images/M/MV5BNTQ4MTA4NTkyN15BMl5BanBnXkFtZTgwMjQ3NzI4NjE@._V1_SX300.jpg
tt6170268,Ian Harvie: May the Best Cock Win,Ian Harvie: May the Best Cock Win,"Ian Harvie is not quite the kind of man you might think. He's redefining what it means to be a dude through a fresh perspective on sex/sexuality with some seriously funny and new kinds of dick jokes. Proving that laughter cuts across all identities and ultimately unites us all. Oh and, Ian is the world's first trans man comedian with a stand up comedy special.",https://images-na.ssl-images-amazon.com/images/M/MV5BNmYwOTNlYTQtYmU2My00ODdkLWJhNTQtNjhkOWRmYTM3MjczXkEyXkFqcGdeQXVyMzcwMjcwNQ@@._V1_SX300.jpg
tt4613254,Heartstone,Hjartasteinn,"A remote fishing village in Iceland. Teenage boys Thor and Christian experience a turbulent summer as one tries to win the heart of a girl while the other discovers new feelings toward his best friend. When summer ends and the harsh nature of Iceland takes back its rights, it's time to leave the playground and face adulthood.",https://m.media-amazon.com/images/M/MV5BNjZkOGI4MDQtN2U4NC00NmIyLTlhMWYtYmM3ZDgxZDRhMTVjXkEyXkFqcGdeQXVyNjg0ODE1ODE@._V1_SX300.jpg
tt3567194,Red Dog: True Blue,Red Dog: True Blue,"Explores the early events leading up to Red Dog's discovery on the road to Dampier, and his ultimate rise from ordinary dog to Australian legend.",https://m.media-amazon.com/images/M/MV5BYzA4MzEzNGEtMjJiMC00YWI2LWJjNzAtYTc4OGQ1ZWY2ODIwXkEyXkFqcGdeQXVyMzExMTY0MjU@._V1_SX300.jpg
tt2672052,Onus,Onus,"A teenager wakes up near a cliff, injured and unable to remember how he got there. He is chained to a man in a suit and there is a gun gaffer-taped to each of their hands. An unknown person soon sends them shocking instructions of what they must do next, as the horror of the situation unfolds with nail-biting consequences.",https://m.media-amazon.com/images/M/MV5BNjkyZTcyYzktMTE0OS00OTI1LTliMzUtMDE3NTAzOGM5ODA2XkEyXkFqcGdeQXVyMjM4ODM3NzE@._V1_SX300.jpg
tt6271404,The Woman in the Septic Tank 2: Forever Is Not Enough,Ang Babae sa Septic Tank 2: #ForeverIsNotEnough,"Eugene prepares for her comeback vehicle after a long sabbatical from movie making. Rainier proposes ""The Itinerary,"" a heartbreaking anatomy of a crumbling marriage as told through a couple's trip to Baguio, their former honeymoon location.",https://images-na.ssl-images-amazon.com/images/M/MV5BN2UxZjIzZWItY2I5YS00MTE3LWJkMTctMjFkN2IwZDcxM2U2L2ltYWdlL2ltYWdlXkEyXkFqcGdeQXVyNTUzMTYwMDM@._V1_SX300.jpg
tt2357423,The Prey,The Prey,U.S. Soldiers in the Middle East become trapped in a cave that is inhabited by a deadly creature.,https://images-na.ssl-images-amazon.com/images/M/MV5BMjI5NTcwOTg3MF5BMl5BanBnXkFtZTgwMjc2MDc1MTE@._V1_SX300.jpg
tt5807628,The Last Dragonslayer,The Last Dragonslayer,"In a fantasy world where magic is being superceded by technology, an orphaned teen discovers her destiny to become a dragonslayer.",https://m.media-amazon.com/images/M/MV5BOGRkYWJhOWYtNDBmZC00YmVkLWFlOTgtNDU4NzA1NDQ5NzcxL2ltYWdlL2ltYWdlXkEyXkFqcGdeQXVyMjE5MTY0OA@@._V1_SX300.jpg
tt4940370,The 101-Year-Old Man Who Skipped Out on the Bill and Disappeared,Hundraett√•ringen som smet fr√•n notan och f√∂rsvann,"Drinking the tasty Folk Soda puts a spring in the 101 Year Old Man‚ step and his next adventure takes him around the World and back to Sweden, during which time he is chased by the CIA, a Balinese debt collector and becomes an executive at a soft drink company.",https://m.media-amazon.com/images/M/MV5BMTU3MzE1Mzc0M15BMl5BanBnXkFtZTgwMTg4Njg0MDI@._V1_SX300.jpg
tt6271180,Seclusion,Seklusyon,"In 1947, those aspiring to be priest are sent to a remote convent to live in seclusion on the last day of their training. The purpose is to shield them from evil of the world. The plot thickens when a mysterious young girl comes to the convent but the question is whether she is really sent by God or by the Evil.",https://images-na.ssl-images-amazon.com/images/M/MV5BZmU0ZTdlNjEtYTQzOC00MDcyLTlhOTItY2U2NjUzZDJjNmVmL2ltYWdlL2ltYWdlXkEyXkFqcGdeQXVyNTI5NjIyMw@@._V1_SX300.jpg
tt2361317,Live by Night,Live by Night,A story set in the Prohibition Era and centered around a group of individuals and their dealings in the world of organized crime.,https://m.media-amazon.com/images/M/MV5BMjc3MDIyMjgzNl5BMl5BanBnXkFtZTgwMzUxOTg3MDI@._V1_SX300.jpg
tt4385888,20th Century Women,20th Century Women,"In 1979 Santa Barbara, California, Dorothea Fields is a determined single mother in her mid-50s who is raising her adolescent son, Jamie, at a moment brimming with cultural change and rebellion. Dorothea enlists the help of two younger women ‚ Abbie, a free-spirited punk artist living as a boarder in the Fields' home and Julie, a savvy and provocative teenage neighbour ‚ to help with Jamie's upbringing.",https://m.media-amazon.com/images/M/MV5BMTkwNDE4NzQwM15BMl5BanBnXkFtZTgwNzQ5Nzg0MDI@._V1_SX300.jpg
tt6011884,Santa Claus. Battle of Mages,–î–µ–¥ –ú–æ—Ä–æ–∑. –ë–∏—Ç–≤–∞ –ú–∞–≥–æ–≤,Young girl Masha accidentally discovers the organization of snow and ice mages fighting the global devil under the leadership of Santa Claus.,https://m.media-amazon.com/images/M/MV5BODgwY2FlMDQtODQ2OC00OGMwLTgzOWYtYjQ1MmRiMjgxMWQ1XkEyXkFqcGdeQXVyNjYzMTAzNTY@._V1_SX300.jpg
tt2592614,Resident Evil: The Final Chapter,Resident Evil: The Final Chapter,"Picking up immediately after the events in Resident Evil: Retribution, Alice (Milla Jovovich) is the only survivor of what was meant to be humanity's final stand against the undead. Now, she must return to where the nightmare began - The Hive in Raccoon City, where the Umbrella Corporation is gathering its forces for a final strike against the only remaining survivors of the apocalypse.",https://m.media-amazon.com/images/M/MV5BMTc0Mzc2OTQ0Ml5BMl5BanBnXkFtZTgwOTQ5MjE4MDI@._V1_SX300.jpg
tt4687848,Railroad Tigers,ÈêµÈÅìÈ£õËôé,A railroad worker in China in 1941 leads a team of freedom fighters against the Japanese in order to get food for the poor.,https://m.media-amazon.com/images/M/MV5BMjdjYWJlNDUtMjU2YS00NDBjLTkzMjEtYWM1ZmE1MjNlOWIyXkEyXkFqcGdeQXVyNzI1NzMxNzM@._V1_SX300.jpg
tt5074352,Dangal,‡§¶‡§Ç‡§ó‡§≤,"Dangal is an extraordinary true story based on the life of Mahavir Singh and his two daughters, Geeta and Babita Phogat. The film traces the inspirational journey of a father who trains his daughters to become world class wrestlers.",https://m.media-amazon.com/images/M/MV5BMTQ4MzQzMzM2Nl5BMl5BanBnXkFtZTgwMTQ1NzU3MDI@._V1_SX300.jpg
tt4501244,Why Him?,Why Him?,A dad forms a bitter rivalry with his daughter's young rich boyfriend.,https://m.media-amazon.com/images/M/MV5BNDlkMDQ1NzUtNGE3OC00NmUwLWI0NjAtNDJmODUzY2NhOGIzL2ltYWdlXkEyXkFqcGdeQXVyNDg2MjUxNjM@._V1_SX300.jpg
tt5840988,Six Degrees of Celebration 5,–Å–ª–∫–∏ 5,"This time on New Year, the favourite heroes of ‚Yolki‚ perform the usual nonsense and hope for a miracle. Borya needs to somehow restore family happiness, and for its sake is ready to steal a penguin from his best friend Zhenya. The Skier and Snowboarder have not matured and stage a mad chase for a Christmas tree. Manya learns how to use the Internet in the hope of finding her old love. The professor from Yekaterinburg has settled down, but now he goes mad from jealousy. In the far North a safety engineer must take a risk and, at last, confess his love. The bloggers who remained with- out Internet have to get out of a lift. Well, and the penguin simply needs to sit down urgently on an egg...",https://m.media-amazon.com/images/M/MV5BYWQzN2RjYjYtMjk3Yi00ZjZkLTlhMTMtZWZhZWVjZDYxZTRiXkEyXkFqcGdeQXVyNjMwOTA1MDM@._V1_SX300.jpg
tt0490215,Silence,Silence,"Two Jesuit priests travel to seventeenth century Japan which has, under the Tokugawa shogunate, banned Catholicism and almost all foreign contact.",https://m.media-amazon.com/images/M/MV5BMjY3OTk0NjA2NV5BMl5BanBnXkFtZTgwNTg3Mjc2MDI@._V1_SX300.jpg
tt6184932,Nick Thune: Good Guy,Nick Thune: Good Guy,"Living legend, Nick Thune, takes the stage in Portland, Oregon and explains his stunning transformation into a good guy.",https://m.media-amazon.com/images/M/MV5BZjI1YTkyNzUtODBlMC00ZWZmLTg4ODYtMGI0ZDgzN2Q0N2I5XkEyXkFqcGdeQXVyMzcwMjcwNQ@@._V1_SX300.jpg
tt3212812,My Mom Is a Character 2,Minha M√£e √© Uma Pe√ßa 2,"Dona Hermv≠nia is back, but now rich and famous since she is the host of her own successful TV show. However, the overprotective character will have to deal with her children's departures, as Marcelina and Juliano decide to move out. In counterpart, she will welcome, as a visitor, her sister Lv∫cia Helena, who's been living in New York.",https://m.media-amazon.com/images/M/MV5BNmVjNGNmZDItZmQ5OC00M2EyLWFkMWYtNTU5ZDdhZjJiYjIwL2ltYWdlL2ltYWdlXkEyXkFqcGdeQXVyMTkzODUwNzk@._V1_SX300.jpg
tt1800302,Gold,Gold,"Kenny Wells, a modern-day prospector, hustler, and dreamer, is desperate for a lucky break. Left with few options, Wells teams up with an equally luckless geologist to execute a grandiose, last-ditch effort: to find gold deep in the uncharted jungle of Indonesia.",https://m.media-amazon.com/images/M/MV5BNjEwNzMzMDI4Nl5BMl5BanBnXkFtZTgwMTM2ODkwMTI@._V1_SX300.jpg
